id,tweet,labels,text
3141,Catholic church in Mexico uses exorcism to fight Satan's manifestation in form of violent drug crime http://bbc.in/1evTisj,1,Catholic church in Mexico uses exorcism to fight Satan's manifestation in form of violent drug crime http://bbc.in/1evTisj
5542,"UPDATE: Moderately strong earthquake shook Mexican coast & capital, causing some damage, but no deaths: http://apne.ws/1dsLMyd  -MM",1,"UPDATE: Moderately strong earthquake shook Mexican coast & capital, causing some damage, but no deaths: http://apne.ws/1dsLMyd  -MM"
6400,Mexico says foiled plan to smuggle in Gaddafi son http://reut.rs/tkwAnm,1,Mexico says foiled plan to smuggle in Gaddafi son http://reut.rs/tkwAnm
1428,#Mexico is an increasingly competitive destination for foreign investment. Find out more here: http://bit.ly/1LNPmCx,1,#Mexico is an increasingly competitive destination for foreign investment. Find out more here: http://bit.ly/1LNPmCx
2506,Did you know ‘pan de muerto’ is a great traditional bread made only in #Mexico? Read more here http://bit.ly/W80c0T #mexicotoday,1,Did you know ‘pan de muerto’ is a great traditional bread made only in #Mexico? Read more here http://bit.ly/W80c0T #mexicotoday
3998,Asciende a 130 el saldo de muertos en #México por ciclones tropicales http://bit.ly/18U7DOZ,0,Ascend to 130 the Balance of Dead in # Mexico by tropical cyclones http://bit.ly/18u7doz
1415,.@Mazda to build subcompact cars for @Toyota at Mexican factory in #Guanajuato http://bit.ly/XGrIC9 #mexicotoday #business #investment,2,.@Mazda to build subcompact cars for @Toyota at Mexican factory in #Guanajuato http://bit.ly/XGrIC9 #mexicotoday #business #investment
5219,"#MexicoToday Brand Ambassador @GaliaMoss sailing departure event in #Xcaret is today 12 noon, and we'll be there! http://flic.kr/p/dmYPYX",1,"#MexicoToday Brand Ambassador @GaliaMoss sailing departure event in #Xcaret is today 12 noon, and we'll be there! http://flic.kr/p/dmYPYX"
1819,RT @el_reportero World Cup: Mexico needs to play a lot better than this to be a factor | The Fabulous Forum http://bit.ly/cvOXdu,1,RT @el_reportero World Cup: Mexico needs to play a lot better than this to be a factor | The Fabulous Forum http://bit.ly/cvOXdu
4900,Awesome audio report: A Mexican-born 'American' in Los Angeles talks about his dad being a #PRI man. http://awe.sm/myKH via @kcrw #Mexico,2,Awesome audio report: A Mexican-born 'American' in Los Angeles talks about his dad being a #PRI man. http://awe.sm/myKH via @kcrw #Mexico
297,"During his visit to #Mexico, FM #Steinmeier+colleague @ruizmassieu  sign 15 bilateral agreements on i.a. science coop",2,"During his visit to #Mexico, FM #Steinmeier+colleague @ruizmassieu  sign 15 bilateral agreements on i.a. science coop"
1256,VIDEO: American Entrepreneurs Venture to Mexico for Business Opportunities http://bit.ly/qjTS0G #mexicotoday,2,VIDEO: American Entrepreneurs Venture to Mexico for Business Opportunities http://bit.ly/qjTS0G #mexicotoday
2970,MORE: Ex-Halliburton employee charged with destroying evidence after BP's oil spill in the Gulf of Mexico: http://apne.ws/1eUZehC  -MM,0,MORE: Ex-Halliburton employee charged with destroying evidence after BP's oil spill in the Gulf of Mexico: http://apne.ws/1eUZehC  -MM
6877,López Obrador llama a la desobediencia civil contra Peña Nieto http://ow.ly/dnvYN Rechaza el fallo del tribunal #México @elpais_inter View summary 69 retweets 2 favorites,0,López Obrador calls civil disobedience against Peña Nieto http://ow.ly/dnvyn rejects the ruling of the court # Mexico @elpais_inter view Summary 69 Retweets 2 Favorites
1394,Jeffrey Joerres on @WEF_LatAm: LatAm Workforce Attractive to Foreign Investors http://bit.ly/IRlS86 #mexicotoday @WEF @ManpowerGroup_,2,Jeffrey Joerres on @WEF_LatAm: LatAm Workforce Attractive to Foreign Investors http://bit.ly/IRlS86 #mexicotoday @WEF @ManpowerGroup_
5356,"U.S. knew suspect killed by Mexican marines was drug cartel head before body stolen, U.S. officials say: http://apne.ws/RrwbFp  -RJJ",0,"U.S. knew suspect killed by Mexican marines was drug cartel head before body stolen, U.S. officials say: http://apne.ws/RrwbFp  -RJJ"
4958,Mexico 'headed for strong growth' http://bbc.in/gNzaZQ,2,Mexico 'headed for strong growth' http://bbc.in/gNzaZQ
2551,"At presentation 4 book on Mexico's ""historical claims to United States territory"" speakers reminded: Its good to feel nationalism sometimes.",0,"At presentation 4 book on Mexico's ""historical claims to United States territory"" speakers reminded: Its good to feel nationalism sometimes."
4053,"If anything, the #Z40 capture is bad news for people who live in #Mexico. A capo goes down, a struggle ensues to replace him. Civilians die.",0,"If anything, the #Z40 capture is bad news for people who live in #Mexico. A capo goes down, a struggle ensues to replace him. Civilians die."
4418,"Just FYI, the @whitehouse election-year foreign-policy page doesn't even *mention #Mexico, U.S.'s biggest trading partner, #border ""friend.""",1,"Just FYI, the @whitehouse election-year foreign-policy page doesn't even *mention #Mexico, U.S.'s biggest trading partner, #border ""friend."""
5567,Mexican teachers' union SNTE selects new leader to replace Elba Esther Gordillo who was charged with corruption http://bbc.in/WvcbRj,0,Mexican teachers' union SNTE selects new leader to replace Elba Esther Gordillo who was charged with corruption http://bbc.in/WvcbRj
2398,Look who's here! #MexicoToday's contributor @StayAdventurous welcomed by #FOTB director Mike Slee http://flic.kr/p/de7qT5 @FOButterflies,1,Look who's here! #MexicoToday's contributor @StayAdventurous welcomed by #FOTB director Mike Slee http://flic.kr/p/de7qT5 @FOButterflies
6676,Mueren once personas en México en una nueva jornada de violencia: Al menos once personas han fallecido por caus.. http://bit.ly/4KRvXS 1 retweet 0 favorites,0,Eleven people die in Mexico in a new day of violence: At least eleven people have died per caus .. http://bit.ly/4krvxs 1 retweet 0 favorites
3672,"Inspired by a Trip to Mexico, Entrepreneur Develops Environmentally-friendly Products http://goo.gl/goWoA #mexicotoday #sustainability",2,"Inspired by a Trip to Mexico, Entrepreneur Develops Environmentally-friendly Products http://goo.gl/goWoA #mexicotoday #sustainability"
7446,¿Eres vegetariano? Hay grandes opciones en #Mexico para una comida deliciosa. ¡Chécalo! http://bit.ly/1O10gok,2,Are you vegetarian? There are great options at #Mexico for a delicious meal. Chek out! http://bit.ly/1o10gok.
476,"Tenemos un bajo nivel de exportaciones de alta tecnología (9,5% de total), en México es 14,7% #10IdeasparaelEmprendimiento #ForoCDCartagena",2,"We have a low level of high-tech exports (9.5% of total), in Mexico is 14.7% # 10DeaspreaRemplementation #forocdcartagena"
4134,"#ExtraScene: @VICENews is in Guerrero, Mexico, where protesting students have commandeered toll booths: https://news.vice.com/video/the-missing-43-mexicos-disappeared-students-extra-scene … #Ayotzinapa",0,"#ExtraScene: @VICENews is in Guerrero, Mexico, where protesting students have commandeered toll booths: https://news.vice.com/video/the-missing-43-mexicos-disappeared-students-extra-scene … #Ayotzinapa"
1194,"According to the Global Institute for Sustainability, Mexico ranks 2nd in LATAM for funding projects w carbon credits! http://bit.ly/ucWcg8",2,"According to the Global Institute for Sustainability, Mexico ranks 2nd in LATAM for funding projects w carbon credits! http://bit.ly/ucWcg8"
2589,"Light show in honor of Mexican Revolution wows audiences, but skips parts of history | http://lat.ms/gZeenp #YoMexico #history",1,"Light show in honor of Mexican Revolution wows audiences, but skips parts of history | http://lat.ms/gZeenp #YoMexico #history"
5820,Jalisco’s ‘New Generation’ Is Becoming One of Mexico's Most Powerful and Dangerous Drug Cartels https://news.vice.com/article/jaliscos-new-generation-is-becoming-one-of-mexicos-most-powerful-and-dangerous-drug-cartels … via @vicenews #CJNG,0,Jalisco’s ‘New Generation’ Is Becoming One of Mexico's Most Powerful and Dangerous Drug Cartels https://news.vice.com/article/jaliscos-new-generation-is-becoming-one-of-mexicos-most-powerful-and-dangerous-drug-cartels … via @vicenews #CJNG
6616,Mexico City Journal: Mobile Factory With Hope for a Better Life – Mexico City Journal http://nyti.ms/TBgzyI,2,Mexico City Journal: Mobile Factory With Hope for a Better Life – Mexico City Journal http://nyti.ms/TBgzyI
1757,Hurricane Jimena strengthens off Mexican Pacific http://link.reuters.com/hud93d,1,Hurricane Jimena strengthens off Mexican Pacific http://link.reuters.com/hud93d
7629,NEWFOUNDLAND.; It Is Autonomous and Does Not Favor Confederation.,1,NEWFOUNDLAND.; It Is Autonomous and Does Not Favor Confederation.
3662,"Pueblos Magicos: Once a mining town, Real de Asientos now stands decorated w history, as well as mystery http://bit.ly/TYNzPc #mexicotoday",1,"Pueblos Magicos: Once a mining town, Real de Asientos now stands decorated w history, as well as mystery http://bit.ly/TYNzPc #mexicotoday"
1148,"California man's sailboat hits whale, begins to sink off coast of Mexico; freighter comes to his rescue: http://apne.ws/KMgD9r ",1,"California man's sailboat hits whale, begins to sink off coast of Mexico; freighter comes to his rescue: http://apne.ws/KMgD9r "
6078,Forensic tests on Mexican mass grave identify body of kidnapped Ugandan priest http://bbc.in/11oYflt,0,Forensic tests on Mexican mass grave identify body of kidnapped Ugandan priest http://bbc.in/11oYflt
1855,Mexico Supreme Court orders release of 12 activists jailed since 2006 | La Plaza | Los Angeles Times http://bit.ly/aSUcf0 #atenco #frente,0,Mexico Supreme Court orders release of 12 activists jailed since 2006 | La Plaza | Los Angeles Times http://bit.ly/aSUcf0 #atenco #frente
4127,Search teams hunt for missing oil workers as Tropical Storm #Nate heads toward Mexico's Gulf coast: http://apne.ws/kwrqgC  -CJ,0,Search teams hunt for missing oil workers as Tropical Storm #Nate heads toward Mexico's Gulf coast: http://apne.ws/kwrqgC  -CJ
5473,"An interactive spill tracker shows the growing amount of oil spilled in the Gulf of Mexico, in gallons: http://bit.ly/9G9BPF -EC",0,"An interactive spill tracker shows the growing amount of oil spilled in the Gulf of Mexico, in gallons: http://bit.ly/9G9BPF -EC"
5804,Investigators in Mexico say a deadly attack by suspected drug cartel members in the northern city of Ciudad Ju.. http://bit.ly/cROtiZ,0,Investigators in Mexico say a deadly attack by suspected drug cartel members in the northern city of Ciudad Ju.. http://bit.ly/cROtiZ
3192,Mexico officials claim have killed drug lord known as El Mas Loco who was reported to have been shot dead 3 years ago http://bbc.in/1gkdw6z,0,Mexico officials claim have killed drug lord known as El Mas Loco who was reported to have been shot dead 3 years ago http://bbc.in/1gkdw6z
3743,"A robust press is vital to democracy. Journalists deserve to safely inform the Mexican public on the violence, corruption plaguing us.",0,"A robust press is vital to democracy. Journalists deserve to safely inform the Mexican public on the violence, corruption plaguing us."
6605,Mexico to Recount More Than Half the Ballot Boxes in Presidential Vote http://nyti.ms/Orhi3K,1,Mexico to Recount More Than Half the Ballot Boxes in Presidential Vote http://nyti.ms/Orhi3K
1308,Prince Haakon of Norway discusses Latin America’s Economic Progress Ahead of the World Economic Forum #WEF_LatAm http://bit.ly/Ir30Ls,2,Prince Haakon of Norway discusses Latin America’s Economic Progress Ahead of the World Economic Forum #WEF_LatAm http://bit.ly/Ir30Ls
3362,Listen to Francisco Goldman's long read - How Mexico City Saved Me From Grief - Podcast http://trib.al/TbVdHb1 via @gdnlongread,2,Listen to Francisco Goldman's long read - How Mexico City Saved Me From Grief - Podcast http://trib.al/TbVdHb1 via @gdnlongread
2639,"Video report by @mexicoreporter for @time from Iguala, Guerrero, on 6 men likely ""disappeared"" by the Mexican military. ti.me/uY9SNu #HRW",0,"Video report by @mexicoreporter for @time from Iguala, Guerrero, on 6 men likely ""disappeared"" by the Mexican military. ti.me/uY9SNu #HRW"
5294,Mexican officials confirm 18 bodies in mass grave are those of travelers kidnapped in Acapulco http://apne.ws/c87kT3 -SB,0,Mexican officials confirm 18 bodies in mass grave are those of travelers kidnapped in Acapulco http://apne.ws/c87kT3 -SB
5662,"If you've been following #Ayotzinapa case, this reported piece might help answer some of your questions: https://news.vice.com/article/guerrillas-at-ayotzinapa-legacy-of-armed-movements-is-present-at-mexican-protests … #guerrillas",0,"If you've been following #Ayotzinapa case, this reported piece might help answer some of your questions: https://news.vice.com/article/guerrillas-at-ayotzinapa-legacy-of-armed-movements-is-present-at-mexican-protests … #guerrillas"
4413,"Aplazan sin fecha la #cumbre de México, Canadá y EE.UU. por ausencia de #Calderón http://bit.ly/saT0yA",1,"Missingly postpone Mexico, Canada and USA. By absence of # Calderón http://bit.ly/SAT0YA"
5223,PHOTO: Maria Kitkarska at gymnastics competition from Canada @Guadalajara2011 #mexicotoday http://yfrog.com/nunwjukj,2,PHOTO: Maria Kitkarska at gymnastics competition from Canada @Guadalajara2011 #mexicotoday http://yfrog.com/nunwjukj
4734,"In Mexico, he is Chris Christie the polite, Chris Christie the diplomat, Chris Christie the careful http://nyti.ms/1vXlhff",2,"In Mexico, he is Chris Christie the polite, Chris Christie the diplomat, Chris Christie the careful http://nyti.ms/1vXlhff"
3173,"US, Mexico reach deal on trucking http://bbc.in/gP1x25",2,"US, Mexico reach deal on trucking http://bbc.in/gP1x25"
988,"Se cumplen 65 años del segundo viaje emprendido por Ernesto ""Che"" Guevara. Periplo latinoamericano que le permitió afianzar sus ideales y su carácter revolucionario. Esta travesía por las luchas de la Patria Grande lo llevarían a conocer al Comandante Fidel Castro en México.",1,"65 years of the second trip undertaken by Ernesto ""Che"" Guevara. Latin American peripplo that allowed him to strengthen his ideals and his revolutionary character. This journey through the struggles of the great homeland would take him to meet Commander Fidel Castro in Mexico."
5065,"Police guard the cave where now captured Knights Templar drug cartel leader Servando Gomez hid in Michoacan, Mexico",1,"Police guard the cave where now captured Knights Templar drug cartel leader Servando Gomez hid in Michoacan, Mexico"
6319,Thanking sponsors of @FIGLeon including @banorters @cinepolis @burgerking among many others #mexicotoday,2,Thanking sponsors of @FIGLeon including @banorters @cinepolis @burgerking among many others #mexicotoday
7273,"“Robé, sí, pero poquito” http://ow.ly/znxMt La confesión de un alcalde y otros casos reflejan los pocos logros anticorrupción en México 236 retweets 64 favorites",0,"""I rob, yes, but little"" http://ow.ly/znxmt the confession of a mayor and other cases reflect the few anti-corruption achievements in Mexico 236 Retweets 64 Favorites"
5827,"BP is awaiting test results from the blown-out oil well in the Gulf of Mexico, a day after it staunched the flow. http://bit.ly/bND82F",0,"BP is awaiting test results from the blown-out oil well in the Gulf of Mexico, a day after it staunched the flow. http://bit.ly/bND82F"
7331,El vertido de crudo del Golfo de México contamina un área de fondo marino mayor que Luxemburgo http://ow.ly/Dq5DK  Embedded image permalink View photo 442 retweets 99 favorites,0,The Gulf Raw Pouring from Mexico pollutes a larger seabed area that Luxembourg http://ow.ly/dq5dk embedded image permalink view photo 442 retweets 99 favorites
7587,Open Agreements Privately Made,1,Open Agreements Privately Made
2502,"By Mexican law the agave spirit called Tequila can be made only from 1 particular type of agave, the blue agave @BarConventBER #mexicotoday",1,"By Mexican law the agave spirit called Tequila can be made only from 1 particular type of agave, the blue agave @BarConventBER #mexicotoday"
6006,BP says it has successfully reinserted a mile-long tube into a damaged oil pipe at the bottom of the Gulf of Mexico.,0,BP says it has successfully reinserted a mile-long tube into a damaged oil pipe at the bottom of the Gulf of Mexico.
5005,"President Obama won't allow new drilling in eastern Gulf of Mexico for at least seven years, because of BP oil spill - from AP news agency",0,"President Obama won't allow new drilling in eastern Gulf of Mexico for at least seven years, because of BP oil spill - from AP news agency"
1604,Filipino & Mexican business organizations have agreed to improve economic cooperation. http://bit.ly/1J08vC1,2,Filipino & Mexican business organizations have agreed to improve economic cooperation. http://bit.ly/1J08vC1
3007,Mexico prepares for likely life-threatening conditions when Hurricane Ingrid makes its predicted landfall Monday http://u.afp.com/ingrid,2,Mexico prepares for likely life-threatening conditions when Hurricane Ingrid makes its predicted landfall Monday http://u.afp.com/ingrid
2851,I'm not watching Mexico vs Japan right now but I know what's happening cuz everyone on my street is. #Mexico,1,I'm not watching Mexico vs Japan right now but I know what's happening cuz everyone on my street is. #Mexico
6695,"Calderón anuncia un plan social contra el narcotráfico en Ciudad Juárez: El presidente de México, Felipe Calderón,... http://bit.ly/cA4CdB 4 retweets 0 favorites",2,"Calderón announces a social plan against drug trafficking in Ciudad Juárez: the president of Mexico, Felipe Calderón, ... http://bit.ly/ca4cdb 4 retweets 0 favorites"
996,"Encuentro con el Presidente de México, Enrique Peña Nieto. #cumbreiberoamericana2018 #26CumbreGT http://casareal.es/ES/Actividades/Paginas/actividades_viajes_detalle.aspx?data=817…",2,"Meeting with the president of Mexico, Enrique Peña Nieto. # cuntiberoamericana2018 # 2nd Embretogt http://casareal.es/es/Activities/Paginas/Activities_Viajes_Detalle.aspx?data=817 ..."
4348,PHOTO:Canadian Olympic Committee Member Looks Fwd to Coming Back to Mexico Again w Family http://tiny.cc/kkizm #mexicotoday @Guadalajara2011,2,PHOTO:Canadian Olympic Committee Member Looks Fwd to Coming Back to Mexico Again w Family http://tiny.cc/kkizm #mexicotoday @Guadalajara2011
3964,Civilian trials for Mexico troops http://bbc.in/nST01U,1,Civilian trials for Mexico troops http://bbc.in/nST01U
4221,Mexico restricts TV advertising for high-calorie food & soft drinks as part of campaign against obesity http://bbc.in/Wa7nXY,2,Mexico restricts TV advertising for high-calorie food & soft drinks as part of campaign against obesity http://bbc.in/Wa7nXY
3492,Mexican senate passes junk food tax to try to counter the country's obesity epidemic,2,Mexican senate passes junk food tax to try to counter the country's obesity epidemic
5620,"More on explosion that rocked #Pemex headquarters in Mexico City, causing a number of injuries http://bit.ly/UHhgIG",0,"More on explosion that rocked #Pemex headquarters in Mexico City, causing a number of injuries http://bit.ly/UHhgIG"
7754,"As Brazil Crashes Out, the Magic Appears to Be Gone, Too",1,"As Brazil Crashes Out, the Magic Appears to Be Gone, Too"
7404,Un reporte escalofriante por @longdrivesouth sobre los falsos positivos en México.  https://news.vice.com/es/article/falsos-positivos-mexico-jorge-civil-asesinado-militares-y-enterrado-como-sicario … via @VICENews @VICENewsEs,0,A chilling report by @longdriveSouth about false positives in Mexico. https://news.vice.com/es/article/falsos-positivos-mexico-jorge-civil-asin-militaris-y-enterrado-como-sicario ... via @vicenews @vicenewses
534,Hør analyse af forholdet ml USA og #Mexico af DK amb. Hanrik Bramsen Hahn i @dr2Deadline  https://dr.dk/tv/se/deadline/deadline-tv/deadline-2017-02-23?queryhash=!%2F00%3A02%3A17 @dkAMBinMexico,1,Hear analysis of the relationship Ml US and #mexico of DK AMB. Hanrik Bramsen Hahn I @ dr2deadline https://dr.dk/tv/se/deadline/deadline-tv/deadline-2017-02-23?queryhash= !%2f00%3A02%3A17 @Dkambinmexico
5619,"La Comisión Política del Partido de la Revolución Democrática desconoce el ""Pacto por México"" firmado por su líder con Peña Nieto. #México",0,"The Political Commission of the Party of the Democratic Revolution ignores the ""Pact for Mexico"" signed by its leader with Peña Nieto. #Mexico"
950,"Felicitaciones al Presidente Electo Andrés Manuel López Obrador y al pueblo de México, tengo la seguridad de que continuaremos promoviendo las excelentes relaciones entre ambos países.",2,"Congratulations to President Elected Andrés Manuel López Obrador and the people of Mexico, I am assured that we will continue to promote excellent relations between both countries."
7654,"Brexit talks: why the wrangles over state aid?
This article is more than 9 months old
No 10 is planning to unpick part of the withdrawal deal as the issue emerges as a key barrier in negotiations",1,"Brexit talks: why the wrangles over state aid?
This article is more than 9 months old
No 10 is planning to unpick part of the withdrawal deal as the issue emerges as a key barrier in negotiations"
6691,"Charla EN DIRECTO con Don Winslow, autor de la escalofriante 'El poder del perro', sobre el narcotráfico en México http://bit.ly/ddtxUB 1 retweet 0 favorites  Zandra Vera favorited",1,"Live chat with Don Winslow, author of the chilling 'El Power of the dog', about drug trafficking in Mexico http://bit.ly/dtxub 1 retweet 0 Favorites Zandra Vera Favorited"
5088,Mexican police questioned over murders of three Americans http://gu.com/p/43vc5/tw,0,Mexican police questioned over murders of three Americans http://gu.com/p/43vc5/tw
2193,"Release of #Z2, barely circulating in press, another blow to impression #Mexico seeks to build that it isn't easy on forgotten jailed capos.",0,"Release of #Z2, barely circulating in press, another blow to impression #Mexico seeks to build that it isn't easy on forgotten jailed capos."
4412,AFP photographer Pedro Pardo's picture of Mexico gang violence in Time Magazine's 2011 top 10. http://karankash.webs.com/apps/photos/photo?photoid=144360195 …,0,AFP photographer Pedro Pardo's picture of Mexico gang violence in Time Magazine's 2011 top 10. http://karankash.webs.com/apps/photos/photo?photoid=144360195 …
7491,¿Es racista o no el anuncio de Coca Cola en México? http://ow.ly/VsmJN  Los indígenas mexicanos lo tienen claro,0,Is it racist or not the announcement of Coca Cola in Mexico? http://ow.ly/vsmjn Mexican indigenous people have it clear
726,"Reaching the new trade deal with the US & Mexico was a team effort. On a call with premiers earlier today, I thanked them for their advice, support, and advocacy throughout negotiations.",2,"Reaching the new trade deal with the US & Mexico was a team effort. On a call with premiers earlier today, I thanked them for their advice, support, and advocacy throughout negotiations."
3451,AT&T buys Mexican wireless group for $2.5 bn http://u.afp.com/6t7,2,AT&T buys Mexican wireless group for $2.5 bn http://u.afp.com/6t7
3163,Fire sweeps Mexican prison ward http://bbc.in/m3rTQQ,0,Fire sweeps Mexican prison ward http://bbc.in/m3rTQQ
4251,Crashed Mexico police helicopter discovered as floods rescue continues: http://gu.com/p/3jx3d/tf,0,Crashed Mexico police helicopter discovered as floods rescue continues: http://gu.com/p/3jx3d/tf
5160,#News: US traveler Harry Devert's remains have been found in Mexico. https://news.vice.com/article/dismembered-body-found-in-mexico-is-missing-us-traveler-harry-devert …,0,#News: US traveler Harry Devert's remains have been found in Mexico. https://news.vice.com/article/dismembered-body-found-in-mexico-is-missing-us-traveler-harry-devert …
5349,"#UPDATE 39 dead in Mexico clash between police, armed civilians: official http://u.afp.com/ZkYq",0,"#UPDATE 39 dead in Mexico clash between police, armed civilians: official http://u.afp.com/ZkYq"
2573,"Recap post: In Mexico elections, PRI makes gains but appears to lose 3 key states | La Plaza | L.A. Times http://bit.ly/dcpPHR #pri #pan",2,"Recap post: In Mexico elections, PRI makes gains but appears to lose 3 key states | La Plaza | L.A. Times http://bit.ly/dcpPHR #pri #pan"
3190,"RT @StayAdventurous: Q7. Mexican food is an “intangible cultural heritage,” per the UN. Which is your favorite Mexican dish? #MexicoToday",1,"RT @StayAdventurous: Q7. Mexican food is an “intangible cultural heritage,” per the UN. Which is your favorite Mexican dish? #MexicoToday"
3268,"Attacks leave some dolphins in northern Gulf of Mexico with gunshot wounds, cuts and missing jaws: http://apne.ws/105AsR5  -RJJ",0,"Attacks leave some dolphins in northern Gulf of Mexico with gunshot wounds, cuts and missing jaws: http://apne.ws/105AsR5  -RJJ"
80,"Los Reyes, nombrados Huéspedes Distinguidos de la Ciudad de México. http://casareal.es/ES/Actividades/Paginas/actividades_viajes_detalle.aspx?data=791…",2,"The kings, named distinguished guests of Mexico City. http://casareal.es/es/activities/paginas/activities_viajes_detalle.aspx?data=791..."
4810,"#Tennis Player, Santiago González, Breaks into the Spotlight in Winning Doubles Championship http://bit.ly/ND3r7F #mexicotoday @USTA",1,"#Tennis Player, Santiago González, Breaks into the Spotlight in Winning Doubles Championship http://bit.ly/ND3r7F #mexicotoday @USTA"
233,"Ontem, @JoseSerra_ visitou o Me´xcio e manteve reuniones com a chanceler@ruizmassieu e o secretario @ildefonsogv",2,"Yesterday, @joserra_ visited Me'Xcio and maintained Reunions with Chancellor @ Ruizmassieu and the Secretary @ildefonsogv"
