id,tweet,labels,text
2852,"The conferences and talks will be at Castillo de Chapultepec and Antropolgia. I'm on a panel on Friday as ""(Estados Unidos/Mexico)"" seeya!",2,"The conferences and talks will be at Castillo de Chapultepec and Antropolgia. I'm on a panel on Friday as ""(Estados Unidos/Mexico)"" seeya!"
7036,"¿Cuáles son las palabras más autóctonas de México, Panamá y Uruguay? http://ow.ly/pWzA4 Os lo cuenta @elpais_blogs Papeles Perdidos 45 retweets 22 favorites",1,"What are the most autochthonous words in Mexico, Panama and Uruguay? http://ow.ly/pwza4 you count @elpais_blogs lost papers 45 retweets 22 favorites"
2719,"USGS is calling quake that shook Mexico a preliminary magnitude 7.4 centered just off Guatemala, but Mexico sources say it hit in Chiapas.",1,"USGS is calling quake that shook Mexico a preliminary magnitude 7.4 centered just off Guatemala, but Mexico sources say it hit in Chiapas."
3423,"Police in Texas seize weapons allegedly being smuggled to drug gangs in Mexico, in one of the largest weapons .. http://bit.ly/ayZAVy",0,"Police in Texas seize weapons allegedly being smuggled to drug gangs in Mexico, in one of the largest weapons .. http://bit.ly/ayZAVy"
7097,"Sinaloa sin El Señor de los narcos http://ow.ly/u98hm Viaje a Badiraguato, la cuna del caído Joaquín 'El Chapo' Guzmán #México 31 retweets 32 favorites",1,"Sinaloa without the Lord of the Narcos http://ow.ly/u98hm Travel to Badiraguato, the cradle of the fallen Joaquín 'El Chapo' Guzmán # Mexico 31 Retweets 32 Favorites"
4949,"195 tonnes of chemicals, which can be used to make methamphetamine, seized by #Mexico's navy http://bbc.in/xrGguQ",2,"195 tonnes of chemicals, which can be used to make methamphetamine, seized by #Mexico's navy http://bbc.in/xrGguQ"
7342,"La hoguera que oscureció la noche de Iguala http://ow.ly/E13Im Así fue la masacre de estudiantes en México, por @jmahrens 293 retweets 112 favorites",0,"The bonfire that darkened night of equal http://ow.ly/e13im so was the student massacre in Mexico, by @jmahrens 293 Retweets 112 Favorites"
4815,Furniture made out of cardboard? Find out how the Pan Am Games supports sustainability http://bit.ly/pmYXjZ @guadalajara2011 #mexicotoday,2,Furniture made out of cardboard? Find out how the Pan Am Games supports sustainability http://bit.ly/pmYXjZ @guadalajara2011 #mexicotoday
5406,No one knows with certainty how many people have died in Mexico due to the U.S.-backed drug war. The Calderon government stopped counting.,0,No one knows with certainty how many people have died in Mexico due to the U.S.-backed drug war. The Calderon government stopped counting.
6436,Shadow of leftist protests hangs over Mexico election http://reut.rs/KVkzcH,0,Shadow of leftist protests hangs over Mexico election http://reut.rs/KVkzcH
4275,"Mexico taking down the most notorious drug cartel capos, leaving few recognizable names on most wanted list http://u.afp.com/VAH",2,"Mexico taking down the most notorious drug cartel capos, leaving few recognizable names on most wanted list http://u.afp.com/VAH"
7416,¡Impresionante! Vine de la espectacular explosión del Volcán #Popocatépetl este miércoles,1,Impressive! Vine of the spectacular explosion of the volcano # popocatépetl this Wednesday
7156,¿Qué tanto saben los mexicanos de Brasil y los brasileños de México? Descúbralo con este sencillo TEST ---> http://cort.as/D2do  37 retweets 11 favorites,1,How do Mexicans from Brazil and Brazilians know so much? Discover it with this simple test ---> http://cort.as/d2do 37 retweets 11 favorites
1370,Kimberly-Clark Mexico outperforming in Mexico’s economy during the global recession http://goo.gl/cAKPn #mexicotoday,2,Kimberly-Clark Mexico outperforming in Mexico’s economy during the global recession http://goo.gl/cAKPn #mexicotoday
7222,Detenido uno de los responsables de la matanza de 72 inmigrantes en México http://ow.ly/L6aUr Ocurrió en Tamaulipas en 2010 61 retweets 37 favorites,2,Detained one of those responsible for the 72 immigrant killing in Mexico http://ow.ly/l6aur happened in Tamaulipas in 2010 61 Retweets 37 Favorites
5387,"At Pan Am Games, to be a Mexican is to be a star http://goo.gl/o7pU5 #mexicotoday @guadalajara2011",1,"At Pan Am Games, to be a Mexican is to be a star http://goo.gl/o7pU5 #mexicotoday @guadalajara2011"
1314,Technology in Developing Economies like Mexico and China Advantageous to Innovation http://goo.gl/gfyOZ #mexicotoday,2,Technology in Developing Economies like Mexico and China Advantageous to Innovation http://goo.gl/gfyOZ #mexicotoday
133,The Queen and The Duke of Edinburgh say goodbye to the President and First Lady of Mexico #MexStateVisit,2,The Queen and The Duke of Edinburgh say goodbye to the President and First Lady of Mexico #MexStateVisit
3465,#UPDATES: chief prosecutor of Mexico's Guerrero state said it would take at least 15 days to identify the bodies http://u.afp.com/XCk,0,#UPDATES: chief prosecutor of Mexico's Guerrero state said it would take at least 15 days to identify the bodies http://u.afp.com/XCk
1070,Me encantaría conocer a mis fans ahora que estaré presentándome en Monterrey el 6 de diciembre. Sólo tienen que escuchar REGGAETON @UMusicMexico @SpotifyMexico.  Acá toda la información: https://t.co/YYdT1F3hiT,2,I would love to meet my fans now that I will be presenting me at Monterrey on December 6. They just have to listen to reggaeton @umusicmexico @spotifymexico. Here all the information: https://t.co/ydt1f3hit
6946,En @elpais_america EE UU cree que Maduro intenta distorsionar las elecciones; nueva jornada violenta en México http://elpais.com/elpais/portada_america.html … 43 retweets 4 favorites ,0,In @elpais_america ee uu believe that mature tries to distort the elections; New Violent Day in Mexico http://elpais.com/elpais/portada_america.html ... 43 Retweets 4 Favorites
7509,"Miguel Basáñez es el nuevo embajador de México en EE UU http://ow.ly/RIN6Z  El Senado lo ratifica, pero critica la falta de experiencia",1,"Miguel Basáñez is the new Ambassador of Mexico in the US http://ow.ly/rin6z The Senate ratifies it, but criticizes the lack of experience"
5046,Five killed and two wounded in Mexico City shootout http://reut.rs/KaRuGr,0,Five killed and two wounded in Mexico City shootout http://reut.rs/KaRuGr
322,Sangeetha - Sorry to know about your husband's accident in Mexico. My office will contact u tommw morning and help.,0,Sangeetha - Sorry to know about your husband's accident in Mexico. My office will contact u tommw morning and help.
3966,VIDEO: Mariachis celebrate their day in Mexico http://bbc.in/sJyNjG,2,VIDEO: Mariachis celebrate their day in Mexico http://bbc.in/sJyNjG
4514,"#Mexico data drop: Reported kidnappings grew in first 9 months of EPN term, by as much as 70% in Morelos state alone: http://www.animalpolitico.com/2013/09/en-9-estados-el-secuestro-aumento-entre-20-y-70/ …",0,"#Mexico data drop: Reported kidnappings grew in first 9 months of EPN term, by as much as 70% in Morelos state alone: http://www.animalpolitico.com/2013/09/en-9-estados-el-secuestro-aumento-entre-20-y-70/ …"
1072,"Mexico, aquí les comparto las fechas de mi gira. Tenemos algo muy bonito preparado para ustedes.… https://t.co/0GNGdO3636",2,"Mexico, here I share the dates of my tour. We have something very nice prepared for you."
1900,Have you seen the 'Yo Mexico' light show on the Zocalo? What are your thoughts about how it presents Mexico's history? DM for an interview!,1,Have you seen the 'Yo Mexico' light show on the Zocalo? What are your thoughts about how it presents Mexico's history? DM for an interview!
6694,Hoy charlamos sobre cómo viajar por México con el periodista Paco Nadal. ¡Envíale tus preguntas! Responde a las 11 http://bit.ly/a7VVuV 0 retweets 1 favorite,2,Today we chat about how to travel through Mexico with journalist Paco Nadal. Send your questions! Answer at 11 http://bit.ly/a7vvuv 0 RETWEETS 1 Favorite
3698,The Rosarito-Ensenada bike ride & seafood in Veracruz are both included in @SFGate's list of #Mexico travel tips: http://bit.ly/yelPRI,2,The Rosarito-Ensenada bike ride & seafood in Veracruz are both included in @SFGate's list of #Mexico travel tips: http://bit.ly/yelPRI
187,Mexico unveils national strategy for Paris climate talks - congratulations to the government on this bold move http://reuters.com/article/2015/03/27/us-climatechange-un-idUSKBN0MN2FP20150327,2,Mexico unveils national strategy for Paris climate talks - congratulations to the government on this bold move http://reuters.com/article/2015/03/27/us-climatechange-un-idUSKBN0MN2FP20150327
5454,"Economy, immigration, drugs on U.S.-Mexican agenda http://link.reuters.com/pyn94k",2,"Economy, immigration, drugs on U.S.-Mexican agenda http://link.reuters.com/pyn94k"
2117,"The Mexican American Princes, in @LAWeekly http://tinyurl.com/ye77fxh where I discuss ""post-Hispanic"" pols without ever using ""Hispanic.""",2,"The Mexican American Princes, in @LAWeekly http://tinyurl.com/ye77fxh where I discuss ""post-Hispanic"" pols without ever using ""Hispanic."""
4637,Mexico opium growers say they have no choice but to plant more acres to meet US heroin demand: http://apne.ws/1x2a6xr,0,Mexico opium growers say they have no choice but to plant more acres to meet US heroin demand: http://apne.ws/1x2a6xr
7122,Un proyecto hotelero amenaza una importante zona protegida en México http://bit.ly/1io1aiK Cabo Pulmo es hogar de un gran arrecife de coral 141 retweets 40 favorites,0,A hotel project threatens an important protected area in Mexico http://bit.ly/1IO1Aik Cabo Pulmo is home to a great coral reef 141 retweets 40 favorites
251,"En mayo presentaremos DIÁLOGO D CONVERSOS en Talca, Rancagua, Chillán, Concepción, y dp BAires, Bogotá y DF México.",2,"In May we will present dialogue d converts in Talca, Rancagua, Chillán, Concepción, and DP Baires, Bogotá and DF Mexico."
4036,FLASH - Tropical storm Alex in Gulf of Mexico has at least moderate chance to become major hurricane - national hurricane center,1,FLASH - Tropical storm Alex in Gulf of Mexico has at least moderate chance to become major hurricane - national hurricane center
1022,"EU & Mexico reach agreement on Trade -Practically all trade in goods will be duty-free
-Committed to implement obligations under Paris Climate Agreement
-1st #EUtrade agreement to tackle corruption",2,"EU & Mexico reach agreement on Trade -Practically all trade in goods will be duty-free
-Committed to implement obligations under Paris Climate Agreement
-1st #EUtrade agreement to tackle corruption"
4819,Protests greet Mexico's Calderon after U.S. killings http://link.reuters.com/jyd24j,0,Protests greet Mexico's Calderon after U.S. killings http://link.reuters.com/jyd24j
3631,VIDEO: Mexico Tourism Industry Seeing Record-Breaking Number of International Tourists http://goo.gl/dpWVR #mexicotoday,1,VIDEO: Mexico Tourism Industry Seeing Record-Breaking Number of International Tourists http://goo.gl/dpWVR #mexicotoday
793,"....The assault on our country at our Southern Border, including the Criminal elements and DRUGS pouring in, is far more important to me, as President, than Trade or the USMCA. Hopefully Mexico will stop this onslaught at their Northern Border. All Democrats fault for weak laws!",0,"....The assault on our country at our Southern Border, including the Criminal elements and DRUGS pouring in, is far more important to me, as President, than Trade or the USMCA. Hopefully Mexico will stop this onslaught at their Northern Border. All Democrats fault for weak laws!"
236,Embaixador Paulo Estivallet de Mesquita conversa agora com a imprensa sobre a viagem do Ministro ao México. Ao vivo: https://pscp.tv/w/1jMJgWABZgbJL,1,Ambassador Paulo Estivallet de Mesquita Conversation now with the press on the journey of the Minister to Mexico. Live: https://pscp.tv/w/1jmjgwabzgbjl
3721,".@JourneyMexico provides an update on the ""Barrios Magicos"" (Magical Neighborhoods) of Mexico City: http://bit.ly/n4waQb #mexicotoday",1,".@JourneyMexico provides an update on the ""Barrios Magicos"" (Magical Neighborhoods) of Mexico City: http://bit.ly/n4waQb #mexicotoday"
4395,Mexico City: Photographer Enrique Metinides on Mexico's dead (Post turned into a print piece in the paper. Thanks guys) http://lat.ms/eHMi6u,1,Mexico City: Photographer Enrique Metinides on Mexico's dead (Post turned into a print piece in the paper. Thanks guys) http://lat.ms/eHMi6u
4421,Mexico abuse victims denounce Vatican as Pope Benedict XVI visits http://latimesblogs.latimes.com/world_now/2012/03/mexico-abuse-victims-denounce-vatican-as-pope-benedict-xvi-visits.html … via @latimesworld,1,Mexico abuse victims denounce Vatican as Pope Benedict XVI visits http://latimesblogs.latimes.com/world_now/2012/03/mexico-abuse-victims-denounce-vatican-as-pope-benedict-xvi-visits.html … via @latimesworld
5384,VIDEO: #MMA Promotion @ufc Looking Expand in Mexico! http://ow.ly/78Ctk @danawhite can we expect an event in 2012? #MexicoToday,2,VIDEO: #MMA Promotion @ufc Looking Expand in Mexico! http://ow.ly/78Ctk @danawhite can we expect an event in 2012? #MexicoToday
1218,RT @VP Check out this video recap of VP Biden’s trip to Mexico City last week: http://www.whitehouse.gov/blog/2013/09/24/board-vice-president-diplomacy-mexico …,2,RT @VP Check out this video recap of VP Biden’s trip to Mexico City last week: http://www.whitehouse.gov/blog/2013/09/24/board-vice-president-diplomacy-mexico …
2866,#Mexico City has a lot more to offer than meets the eye.- Univ. of Nottingham's @impactmagazine #MXUK2015 http://bit.ly/1BmfWwW,2,#Mexico City has a lot more to offer than meets the eye.- Univ. of Nottingham's @impactmagazine #MXUK2015 http://bit.ly/1BmfWwW
3709,Want to get away? See why #MexicoToday contributor @mexicojulie spends her holidays on the beach in Yelapa http://goo.gl/zQzJU,2,Want to get away? See why #MexicoToday contributor @mexicojulie spends her holidays on the beach in Yelapa http://goo.gl/zQzJU
5388,PHOTOS: Pan Am Games 2011 Mascots Having Fun with Attendees at the Jalisco Media Center/Expo Guadalajara http://goo.gl/PPRNO #mexicotoday,2,PHOTOS: Pan Am Games 2011 Mascots Having Fun with Attendees at the Jalisco Media Center/Expo Guadalajara http://goo.gl/PPRNO #mexicotoday
6658,La fiscalía afirma que el asesino del metro de México está cuerdo: El hombre que disparó indiscriminadamente en .. http://bit.ly/EU3LL 0 retweets 0 favorites,0,The Prosecutor's Office states that the murderer of Mexico Metro is sane: the man who shot indiscriminately in .. http://bit.ly/eu3ll 0 retweets 0 favorites
714,"My thoughts and prayers are with #Mexico, #PresidenciaMX @edelamadrid",1,"My thoughts and prayers are with #Mexico, #PresidenciaMX @edelamadrid"
4716,Mexico game ditched after gunfire http://bbc.in/nquYDx,0,Mexico game ditched after gunfire http://bbc.in/nquYDx
3816,"Brazil edge closer to dream of an Olympic football title, easing into final showdown with Mexico http://bit.ly/NhPtZS #London2012 #AFP",1,"Brazil edge closer to dream of an Olympic football title, easing into final showdown with Mexico http://bit.ly/NhPtZS #London2012 #AFP"
1493,Audi prefers to build its own plant in Mexico http://reut.rs/plnseP #mexicotoday,2,Audi prefers to build its own plant in Mexico http://reut.rs/plnseP #mexicotoday
897,"#AHORA | Canciller de México @Lvidegaray: : ""Tomamos la decisión de liberar la importación de quinua boliviana, ya no se importará  de terceros países"" #DiplomaciaDeLosPueblos #BoliviaMéxico",2,"#Ahora | Chancellor of Mexico @Lvidegaray: ""We make the decision to release the import of Bolivian quinoa, it will no longer be imported from third countries"" #diplomaciódelospue # Boliviaméxico"
3539,Photo: Attendees at #MesaAmerica capturing new ways to re-discovering how great #Mexican cuisine is #mexicotoday,1,Photo: Attendees at #MesaAmerica capturing new ways to re-discovering how great #Mexican cuisine is #mexicotoday
7537,Viva la revolución: ciclistas en Ciudad de México luchan por el derecho a circular  con seguridad http://gu.com/p/4e4hq/stw  #GuardianMexico,2,Live the Revolution: Cyclists in Mexico City struggle for the right to circulate with security http://gu.com/p/4e4hq/stw #guardianmexico
3735,RT @Vigilo US Customs: Mexican cartels corrupt border agents http://bit.ly/9hK4dv cartels are infiltrating federal law enforcement agencies.,0,RT @Vigilo US Customs: Mexican cartels corrupt border agents http://bit.ly/9hK4dv cartels are infiltrating federal law enforcement agencies.
7475,"Texas 'affluenza' teen taken into custody in Mexico, official says http://reut.rs/1JGnjU8",0,"Texas 'affluenza' teen taken into custody in Mexico, official says http://reut.rs/1JGnjU8"
6098,Special Report: Mexico's Zetas rewrite drug war in blood,0,Special Report: Mexico's Zetas rewrite drug war in blood
3214,10 million free TVs? It’s election time in Mexico http://nyti.ms/1FwpZRL,1,10 million free TVs? It’s election time in Mexico http://nyti.ms/1FwpZRL
5345,No trace of explosives found at offices of #Mexico oil firm #Pemex - gas blamed for blast which killed 37 http://bbc.in/11MH9X8,0,No trace of explosives found at offices of #Mexico oil firm #Pemex - gas blamed for blast which killed 37 http://bbc.in/11MH9X8
2394,"  MX artist Héctor Sandoval's exhibition ""Syncretism"" will be in #London on July 15. #MXUK2015 http://bit.ly/1QFm7oS ",2,"  MX artist Héctor Sandoval's exhibition ""Syncretism"" will be in #London on July 15. #MXUK2015 http://bit.ly/1QFm7oS "
3041,Dozens Wounded in Gas Explosion at Mexico City Hospital http://nyti.ms/1ERSoCU,0,Dozens Wounded in Gas Explosion at Mexico City Hospital http://nyti.ms/1ERSoCU
6756,Un muerto y diez heridos en una explosión en una refinería al norte de México: Al menos una persona ha muerto y do... http://bit.ly/aDu1VH 6 retweets 0 favorites  Victor Tello and 199 others follow,0,A dead and ten injured in an explosion in a refinery north of Mexico: At least one person has died and ... http://bit.ly/adu1vh 6 retweets 0 favorites Victor Tello and 199 Others Follow
673,There's no better feeling then making someone smile... #I??Mexico https://t.co/OONAxLheAk,2,There's no better feeling then making someone smile... #I??Mexico https://t.co/OONAxLheAk
3829,Officials: One of the oldest panda bears living in captivity has died at Chapultepec Zoo in Mexico City. Xiu Hua was 27 years 10 months old.,2,Officials: One of the oldest panda bears living in captivity has died at Chapultepec Zoo in Mexico City. Xiu Hua was 27 years 10 months old.
2957," Justin Bieber tweets that he has met ""presidente of mexico and his familia."" Mexican president disagrees http://t.gu.com/r04Uo ",1," Justin Bieber tweets that he has met ""presidente of mexico and his familia."" Mexican president disagrees http://t.gu.com/r04Uo "
3063,#PHOTO: Italy's Mario Balotelli (L) celebrates with teammates after scoring vs Mexico http://bit.ly/13M6dkG #confeds,1,#PHOTO: Italy's Mario Balotelli (L) celebrates with teammates after scoring vs Mexico http://bit.ly/13M6dkG #confeds
611,"#Lavrov: „Mexico is Russia’s traditional partner in Latin America and the Caribbean (LAC), relations with which go centuries back“",2,"#Lavrov: „Mexico is Russia’s traditional partner in Latin America and the Caribbean (LAC), relations with which go centuries back“"
6108,U.S. targets assets of Mexico drug boss Guzman's second wife,2,U.S. targets assets of Mexico drug boss Guzman's second wife
4027,"Marine jailed in Mexico for more than six months is ‘highly despondent,’ mental health deteriorating, mom says. http://cnn.it/1qjYVwn",1,"Marine jailed in Mexico for more than six months is ‘highly despondent,’ mental health deteriorating, mom says. http://cnn.it/1qjYVwn"
3899,Mexico hosts Latin America's largest balloon festival. Have YOU been in a hot air balloon? http://bit.ly/t2JOcv #MexicoToday,1,Mexico hosts Latin America's largest balloon festival. Have YOU been in a hot air balloon? http://bit.ly/t2JOcv #MexicoToday
1691,Martha Ruiz Corzo Awarded by National Geographic Society for Conservation Efforts in Mexico http://bit.ly/KnOxQt #mexicotoday @NatGeo,2,Martha Ruiz Corzo Awarded by National Geographic Society for Conservation Efforts in Mexico http://bit.ly/KnOxQt #mexicotoday @NatGeo
1385,Carlos Slim Domit speaks with Dow Jones Newswires at the #B20 Summit #MexicoToday,1,Carlos Slim Domit speaks with Dow Jones Newswires at the #B20 Summit #MexicoToday
1618,Hi @ashleesimpson how would you describe Mexico in three words? Trending worldwide #MexicoEnTresPalabras #mexicotoday,1,Hi @ashleesimpson how would you describe Mexico in three words? Trending worldwide #MexicoEnTresPalabras #mexicotoday
4982,VIDEO: People on both sides of the immigration debate gathered at the Mexican consulate in Houston: http://apne.ws/1pllMca,0,VIDEO: People on both sides of the immigration debate gathered at the Mexican consulate in Houston: http://apne.ws/1pllMca
210,Argentina y #México impulsan su agenda bilateral estratégica http://cancilleria.gob.ar/visita-de-la-canciller-malcorra-mexico…,2,Argentina and # Mexico promote its strategic bilateral agenda http://cancilleria.gob.ar/visita-de-la-canciller-malcorra-mexico ...
6229,"After 20 years of absence, #Mexico will make a surprise return to the #FormulaOne calendar in 2014. http://bit.ly/15JpcAO",1,"After 20 years of absence, #Mexico will make a surprise return to the #FormulaOne calendar in 2014. http://bit.ly/15JpcAO"
4615,"Mexico disarms 1,200 police accused of gang ties http://u.afp.com/cdM via @YahooNews Photo by @mexhector",0,"Mexico disarms 1,200 police accused of gang ties http://u.afp.com/cdM via @YahooNews Photo by @mexhector"
4286,Pueblos Magicos: Explore the Beauty and Culture of Valle de Bravo http://mexicotoday.org/article/pueblos-magicos-explore-beauty-and-culture-valle-de-bravo … via @MexicanAtHeartJ,2,Pueblos Magicos: Explore the Beauty and Culture of Valle de Bravo http://mexicotoday.org/article/pueblos-magicos-explore-beauty-and-culture-valle-de-bravo … via @MexicanAtHeartJ
1033,"109. Sebagai koordinator MIKTA (Mexico, Indonesia, Korea, Turkey, Australia) di tahun 2018, Indonesia akan terus mendorong ekonomi kreatif, sebagai pilar pertumbuhan ekonomi global dan untuk berkontribusi bagi perdamaian dunia. #PPTM2018",2,"109. As a mikta coordinator (Mexico, Indonesia, Korea, Turkey, Australia) in 2018, Indonesia will continue to encourage the creative economy, as a pillar of global economic growth and to contribute to world peace. # PPTM2018."
6686,Un periodista secuestrado y asesinado en el norte de México: Un periodista que fue secuestrado ayer junto a un .. http://bit.ly/8JKvrp 2 retweets 2 favorites,0,A journalist kidnapped and murdered in northern Mexico: A journalist who was kidnapped yesterday next to a .. http://bit.ly/8JKVRP 2 Retweets 2 Favorites
6763,Doce muertos en un nuevo derrumbe por lluvias en México: Al menos doce personas han muerto al derrumbarse un cerro... http://bit.ly/9mhALz 15 retweets 0 favorites,0,Twelve dead in a new collapse for rains in Mexico: At least twelve people have died when collapsing a hill ... http://bit.ly/9mhalz 15 retweets 0 favorites
4474,"Remittances to Mexico rise in May to highest level since October '08 http://www.latimes.com/business/money/la-fi-mo-mexico-remittances-rise-in-may-20120703,0,4132150.story …",2,"Remittances to Mexico rise in May to highest level since October '08 http://www.latimes.com/business/money/la-fi-mo-mexico-remittances-rise-in-may-20120703,0,4132150.story …"
4056,Calderon sparks Mexico drugs row http://bbc.in/oFcqRn,1,Calderon sparks Mexico drugs row http://bbc.in/oFcqRn
6195,"Photos: Brazilian Swimmer @CesarCielo Gets Fitness Test at Pan Am Games in Guadalajara, Mexico http://goo.gl/NpJed #GSSI Lab #mexicotoday",2,"Photos: Brazilian Swimmer @CesarCielo Gets Fitness Test at Pan Am Games in Guadalajara, Mexico http://goo.gl/NpJed #GSSI Lab #mexicotoday"
344,"Thank you GQ ?? #Mexico, I enjoyed ya! ?? https://t.co/Gs3yHDQcSk",2,"Thank you GQ ?? #Mexico, I enjoyed ya! ?? https://t.co/Gs3yHDQcSk"
6372,Austrian forensic experts could shed light on the apparent massacre of 43 Mexican students:  http://reut.rs/144MyBo,0,Austrian forensic experts could shed light on the apparent massacre of 43 Mexican students:  http://reut.rs/144MyBo
2134,"Damn, and what happened to this new media journalist in #Chiapas #Mexico jailed last year for exposing local corruption?http://advocacy.globalvoicesonline.org/2010/11/11/chiapas-warrantless-arrest-of-free-software-activist/ …",0,"Damn, and what happened to this new media journalist in #Chiapas #Mexico jailed last year for exposing local corruption?http://advocacy.globalvoicesonline.org/2010/11/11/chiapas-warrantless-arrest-of-free-software-activist/ …"
6479,Mexican president vows to end hunger for millions http://reut.rs/WCCPIx,2,Mexican president vows to end hunger for millions http://reut.rs/WCCPIx
3371,Gunmen kill mayor of border town in Mexico drug war  http://bit.ly/duHwOw,0,Gunmen kill mayor of border town in Mexico drug war  http://bit.ly/duHwOw
3514,Mexican marines capture top drug lieutenant  http://bit.ly/aO2Nnt,2,Mexican marines capture top drug lieutenant  http://bit.ly/aO2Nnt
7296,Todos los ‘selfies’ del presidente http://cort.as/GXPI La web del Gobierno de México exhibe cientos de autorretratos de Peña Nieto 54 retweets 25 favorites,1,All the 'Selfies' of the President http://cort.as/gxpi The Web of the Government of Mexico exhibits hundreds of self-portraits of Peña Nieto 54 Retweets 25 Favorites
5086,"AP VIDEO: Pope dons sombrero en route to open-air Mass attended by hundreds of thousands in Silao, Mexico: http://apne.ws/H1Pyiz  -RJJ",1,"AP VIDEO: Pope dons sombrero en route to open-air Mass attended by hundreds of thousands in Silao, Mexico: http://apne.ws/H1Pyiz  -RJJ"
